<?xml version="1.0" encoding="UTF-8"?>
<jdbcluster xmlns:xsi="http://www.w3.org/2001/XMLSchema-instance" 
	xsi:noNamespaceSchemaLocation="jdbcluster.xsd">
	
	<!-- Definition of available Cluster Objects-->
	<clustertype>
		
		<!--configure cluster CAuto-->
		<cluster id="auto" class="mycluster.CAuto">
			
			<!--special filter "name" for cluster CAuto is available-->
			<!--select: ...where NAME=test.testfilter.NameFilter.getName()-->
			<select id="name" hql="NAME=:UNITNAME">
				<FilterClass class="test.testfilter.NameFilter">
					<binding var="UNITNAME" attribute="name"/>
				</FilterClass>
			</select>
			<!--select for coordinates-->
			<select id="position" hql="LATITUDE=:LAT and LONGITUDE=:LONG">
				<FilterClass class="test.testfilter.PositionFilter">
					<binding var="LONG" attribute="longitude"/>
					<binding var="LAT" attribute="latitude"/>
				</FilterClass>
			</select>
			<!--select only for LATITUDE-->
			<select id="positionLatOnly" hql="LATITUDE=:LATONLY">
				<FilterClass class="test.testfilter.PositionFilter">
					<binding var="LATONLY" attribute="latitude"/>
				</FilterClass>
			</select>
		</cluster>
		
		<!--configure cluster CFahrrad-->
		<cluster id="fahrrad" class="mycluster.CFahrrad"/>
		
	</clustertype>
	
	<!--confure available dao classes-->
	<daotype>
		
		<!--configure dao class Auto-->
		<dao id="Auto" class="dao.Auto">
			
			<!--sets parameter longitude to 1.234-->
			<property name="longitude">
				<value>1.234</value>
			</property>
			<!--sets parameter latitude to 5.678-->
			<property name="latitude">
				<value>5.678</value>
			</property>
			<!--sets parameter name to MyDefaultAutoName-->
			<property name="name">
				<value>MyDefaultAutoName</value>
			</property>
		</dao>
		
	</daotype>
	
</jdbcluster>
